comments,subreddits
"He literally wrote [SAO](/s ""an entire AI to store as an ingame item"") in a matter of seconds, with no knowledge of the game's source code (which he would need as he was actually messing with the game's source code). It was pretty stupid regardless of whether you think the show is good or not.",1
"I stream to my TV and every time an explosion comes up, I think that it's gonna explode",1
"It's not. I haven't watched it, but I don't think it fits the description.",1
"&gt;I wonder if sexy Meteora is going to be relevant in non-recap context. 

I'm sure that she will be relevant in doujinshis. ( Í¡Â° ÍœÊ– Í¡Â°)",1
Yeah the ones I found were kosu and otaku. Have you used either?,1
"Toyota can't fool me. I've seen Macross Plus. Digital popstars are not to be trusted.

Besides, it's still a boring-ass Corolla.",1
"Hell, if you like dark stuff, you'll *love* American comic books of the 1980s or so, right?",1
I didn't even think it was good enough to finish watching. ,1
"Idk, how often do you see a dark-skinned anime girl? Let alone one this moe?   
I'm not saying that it's a fitting name, but as far as a description, her skin color is worth noting. It has little to do with race, and is promoting the girl as cute BECAUSE of the skin color anyways.",1
"My response to that line was ""Wait wut. Pretty sure that's Cantonese. There's some Japanese words that sound similar but I haven't heard whole phrases."" ",1
"Weird, I actually consider the show's pacing to be one of its strongest elements. Stein's Gate, by comparison, is torpid and bloated and a pain to slog through.",1
"Small Hint. A bit like saying 'Here's a tiny clue, the number you're looking for is an integer after 7 but before 9.'",1
Thank you very much! I'll check out Nodame then since I've (unfortunately) already seen Hanasaku Iroha. My favorite PA works anime and one of the shows I've had most fun watching! ,1
He said 3-4 clones are his limit in the movie.,1
"Google translate of text on video:

0:09 This is a story of the World Line which was never told

0:12 November 2010 Beta World Line at the end of overcoming countless hardship and sorrows, Rintaro Okabe gave up on rescuing her

0:15 Okabe who is sinking is despair and fellows who worry about him

0:18 What happened to ""Her"" who was not saved?

0:19 And what fate is waiting for the world without her?

0:27 Toward an uncertain future! Zero gate is open

0:34 Let's say it again, my name is - 

0:41 Steins Gate Zero    ***can't correctly recognize second line, something along lines:*** production(?) in progress!

0:44  We made decision to rebroadcast Steins;Gate in October 2017

rest in progress...",1
"Muh immersion is the same stupid generic excuse given for all fanservice shows. I don't buy it, because I had no problems with immersion. 

And my point wasn't about Zero itself, but the attitude of many of it's fans looking down on the rest of the franchise as ""immature"" ""pandering"" or whatever just because it doesn't have muh ""mature adult characters"" 

I don't want that attitude showing up in Prisma with people praising the movie over the rest of the ""disgusting lolicon pandering garbage""

Anyways, fact is, you CAN'T watch this movie without  either watching the anime or reading the manga up to the point where Shirou starts telling his story",1
I guess binge watching Konosuba has addled my brain! XD,1
"In Vic2, I'd also put add other music as well - but I'd try to keep it thematic.

So added a lot of different stuff and really enjoyed most of it, but in particular, I really enjoyed the stuff I added from the Russian Army Men's Choir.

In particular, the [Song of the Volga Boatmen](https://www.youtube.com/watch?v=uNb54rwDQJM), and the [Rider's March](https://www.youtube.com/watch?v=xO--1pFyqeY), and [Katyusha](https://www.youtube.com/watch?v=2SLvtP6KMUM) really stood out to me.",1
Maybe the best way to get it is to download jdip and mess around.,1
"**THIS IS TOO CUTE !**  
[](#uwaa)  

That little angel is so adorable O_O  
Everything was just so adorable, the little centaur girl, the three kittens and the kissing stuff/playing.  
The talk about girls kissing was kinda weird but I don't mind the topic.  
Also the reveal of that one girl being a nice ghost was kinda weird but again, I don't mind.  
I feel bad for the older angel sister hope we get to see her have some fun :)",1
"I've never seen actual hate towards Jojo, if anything some people disliked the third season",1
Hajime no Ippo got me out of that slump easily.,1
"It's not ""horny teen boy"" mature, it's the ""people die"" sort of mature. It's also really slowly paced.",1
Why is it that whenever I even see Anohana mentioned I get sad? and that is really close.,1
"as oc, can confirm: akatsuki is of age and i have dated people shorter than me. i ship akatsuki and shiroe tbh",1
I did see the first 3 episodes at least. I did make an error saying it was manga because of the name eromanga sensei. It's light novels. But that wasn't really my point. ,1
"That was roughly my reading/interpretation after Fate/zero, but it's directly contracted by Grand Order. Alexander was definitely special to Waver, even a decade later, but Waver wasn't special to Alexander.",1
in this timeline: Re:Creators is a parody of events that are actually transpiring as we speak.,1
"Not if you are a girl. He wouldn't be able to even see Kyubey. Nor help you fight if you become a magical girl.

[Madoka spoiler](/s ""Not to mentioned that God-madoka or devil-homura could be argued to be stronger than him"")",1
"Okay, but they won't be HD and a lot of them are... forgive me for saying this, *not that great.*",1
"Haha, I lost it when someone said 'KappaPride get out lady' at the ending scene.",1
"Her unique design? especially that armor and sword. Also Deen ending leave a heavy impact as it's a bitter sweet ending with ""Kizuna"" play on the background.",1
"The part that bothers me about Monster Girls is not the character interactions but that the *writers* chose not to address sexual orientation even after giving it passing mention. Again, I think it would have made a very natural segue into talking about *real world* issues of identity and differences. Then the story could have just as easily slipped back into fantasy issues. I think they would have done a good job of it, too! The whole ""don't just pretend demis are 'normal'; accept them as demis!"" scene was great. It'd have been easy for the writers to fall into the ""they are just like everyone else"" trap, but they didn't.",1
I'm really appreciating the backgrounds in this show. Lots of colour and detail which I love.,1
"Ah, I asked you for details sorry, I should have been more considerate of your privacy given we're stickied!

[Sorry Lofti!](#katoupls)

",1
"&gt;  her extremely weak Mad Enhancement

What? 

Kiyohime's Mad Enhancement rank is EX. ",1
"Play hercules in smite and have a friend play scylla, be an unkillable monster and protect the loli",1
"[](#hououinseesit)

I feel it's too early to tuturu yet, but hopefully the 28th will bring us the news we want to hear.",1
Woah! KagomeXInuyasha lost? That's like a classic OG ship. Huh...,1
That wouldn't make sense. Spiral wars were something like a thousand years before the events of gurren lagann,1
The soreness went away for me after I lost feeling in both my legs and had them amputated. ,1
"Mother's Basement phrased it well when comparing Konosuba to Re:Zero. Re:Zero is about a group of people struggling to survive despite how shitty their world is while Konosuba is about a group of people struggling to survive despite how shitty they are.

In short, yes. It's hilarious xD",1
"Similar in the ways of ""choices leading to slapstick?"" not really. I guess Date a Live may possibly work.

However, you may find enjoyable anime within the romantic-comedy genre.",1
"I would take my time to solve it and not write down anything apart from maybe your final thought process (of course you can still do it if you want. I just think that it's unecessary). Whatever you decide to write, i will read it though. I had several dead ends myself :D

Just try not to look at Bern's stupid grin for too long; it breaks you... :D

~~Btw, the awesome song that's playing in the menu is [The Executioner](http://viewpure.com/hg9XPcPKYAQ?start=0&amp;end=0), Bernkastel's theme~~

",1
yeah. I'm surprised that things seem to be moving into a very distinct alliances sort of way. I feel like we need to start naming our alliances.,1
"that's fine. Soon the first thing you'll think of will be [""Conqueror of Europe!""](https://s-media-cache-ak0.pinimg.com/originals/44/7a/80/447a8062acb6b3a11bc1fc7f13f1edfc.jpg)
",1
Lets be honest though. Criticizing the overuse of stills and other budget-saving techniques is par for the course in anime reviews. No one would care if not for the tragedy involved. ,1
"That or straight up importing, but that will cost a LOT.

~~Still planning on doing that eventually at least for my favorite shows when I finally get disposable income~~",1
"Boruto uses them much more intelligently, but Naruto can make lots more than Boruto can, so he relies on brute force.",1
"Don't sell yourself short that's pretty much exactly what the show says in Hanekawa's arcs. It's much more ""why not Hanekawa"" than ""why Hitagi instead"".

She can't be anything less than perfect because she won't let anything short of perfection show. Not only was her being perfect a brickwall for him because of what you wrote, she also failed to reveal a lot about her. All the stuff Gahara bared from the get go.

I also think it goes both ways: the way Hanekawa saw him was wrong for him too. Black Hanekawa goes on a bit about this: she idealized him too, the supernatural boy who was going to fix her life. With Hitagi treating him (well, on the surface right?) like shit, abusing him verbally, at least they agree on something.

Last thing is, if he hadn't met Gahara until, say, after the second cat arc, or the tiger arc at least, when Hanekawa was ready to deal with her problems, Ragi was in a bit of a better place for a while, he didn't idolize her as much, knew her better, then who knows.",1
It is available in South Africa for some reason and we usually get shafted.Chances are another company has exclusive rights to the WSJ characters so it can't be made available,1
Whats the anime he shows that is CG without the cellshading? The one with the girl in front of the PC.,1
"Pretty sure I saw Cristina Vee cosplaying in one the pics. If it's not her, I know she was at the con though.",1
"FMAB was kind of boring and i only watched the last few dozen eps bc I was like fuck it I've made it this far I have to finish it now. Edward accomplished almost nothing in any of the last fights, the flame alchemist was OP as fuck compared to him, and the way that father was finally defeated was the deux ex machina to end all deux ex machinas. (Am I using that term right? Probably not.) I'm exaggerating a little bit for the sake of this thread, it was still ok, but really not as good as it was made out to be IMO",1
"&gt; 3 points 

Reveal yourself 

[](#mug6)

I already told you what I eat, don't tell me you forgot already? ",1
"Watching all of SNK s1 (25eps 8-9 hours) over the course of 16hours, consisting of sleep, exercise and eating (when I wasn't watching anything)
I also watched a further 11eps of SAO that night despite having only had 1-2 hours of sleep in the last 30 hours ",1
"awkward there are many shounen shows, looks like you only posted the ones you know.",1
"This episode was just brilliant. Besides the neat comedy bits and that sequence in the beginning showing just how much this anime gets me, there was plenty of seemingly uninportant dialogue that stealthly fleshed out the mindset of the creations, their attachment to the real world and the mindset of people who create stories. This kind of episodes where they drive the narrative forward even without big events are my favorites.

Boy, I just had a discussion with an idiot who took issue with Selesia driving, because in his mind, ""why would they give a girl who just left hospital (wrong, by the way) a driver's license?"". 

What teh fuck!",1
"He's been watching anime with sexually explicit themes on his grandmother's iPad without using private browsing. I'm looking for advice on this particular issue. I obviously wouldn't come to this sub for advice on issues outside of that. I can't figure out what about the post triggered an aggressive response but if you could explain it to me I'd appreciate it. I wouldn't want to say anything to upset him over something that's completely normal, just a little awkward.",1
"That's because they're interesting, unlike characters from Saekano and Monogatari (at least in my opinion). Furthermore, they're waifus, not wives, so it doesn't matter if they're batshit crazy, because the person will never have to deal with their attitude.",1
"I watched and read through Grisaia, and realized no matter how bad I think my life is, there's always someone who has it 10x worse, but is still fighting. ",1
"&gt;Clicks on link

*I knew it was going to be a cat.*

*I'm still disappointed that it was a cat.*",1
"Same, recommended it and Food Wars to a total perv friend, great success",1
"&gt; I think the centaurs are the rulers of the current society?

No. No race is above the other in that country. The soldiers just happened to be centaur's. The walking assistance being four legged makes sense for stability and if the next best thing to that are centaur's it's just good to take it.",1
"*9 hours later*

I wish I could speak French fluidly enough to twist tongues.

Wait, that could have a really dirty meaning...

Also, there's a new thread up!",1
"&gt;Archer using swords

""But that's the red Archer, what about the yello--""

&gt;realizes it's still a ton of swords

""Oh.""",1
"The right answer?

What happened I heard people where really enjoying at the start of the season",1
"Garrus being the MC of [Paragon Lost](https://i.gyazo.com/728e453c8ca5eafdf4e1efda2df5009c.png)? Yeah, that would be better than the fucking Vega I think",1
"SAO was kind if a joke actually... I used to have season one as a 7/10 and Season two as a 9/10... everyone used to bully me for liking SAO that much (mostly for giving SAO II a nine) so I just thought it'd be funny if I change it to a 10....

And Fairy Tail is awesome, I love it...................

&gt;For LL if you put 9 on S2 then 10 on the movie? 

I think Season 2 is better than the movie... I have the movie as a 9 though, and season 2 *used* to be a 10... I might change it back to a 10 later if I feel like it...",1
Oh no this is so accurate to me. At least I know I'm not the only one who's complete trash at fighters. ,1
"Mirror here: https://www.ceddit.com/r/anime/comments/6mq0v6/the_weaboo_leveling_guide/?sort=new

Since the site's certificate is not valid, I also pasted the contents here: https://pastebin.com/cke6Nwpt",1
"**Saekano**

Best: Kasumigaoka

Worst: Eriri

**Hyouka**

Best: Irisu

Worst: Chitanda (sorry guys)",1
"If the credit card wasnâ€™t necessary, Tenso would be a viable option (forwarding address service). ",1
"It could have been lewder.

I could have kept writing

[](#evilgrin)

Wasn't really that bad, was it?",1
"#Completed

[**The iDOLM@STER Cinderella Girls**](https://myanimelist.net/anime.php?id=30344)

I completed Season 2. I would say it's equally as good as the first season, which is rare, because second seasons tend to be either better or worse than their first seasons. It is very memorable. I pretty much know all of the characters now. **8/10**

[**Inu x Boku SS**](https://myanimelist.net/anime.php?id=11013)

It's a sweet romance anime that I really enjoyed watching. I liked most of the characters, and I just love the atmosphere this anime gives off. **8/10**

[**Strawberry Marshmallow**](https://myanimelist.net/anime.php?id=488)

This is a good CGDCT anime. I was surprised on how very little fanservice there is in this anime, especially during the bath scenes. The comedy is rather mild, and it's a very simplistic anime. It's a good show for unwinding. **7.5/10**

#Started

[**Shugo Chara \(Up to Episode 3\)**](https://myanimelist.net/anime/2923/Shugo_Chara)

Because I'm planning to watch some ecchi harems next, I needed to watch a long-running anime that's relatively SFW and is available on Crunchyroll. So I started watching Shugo Chara. It's cute, but it's nowhere near Cardcaptor Sakura in terms of quality. This anime uses a lot of facial expressions. Also Amu really reminded me of Ririchiyou from Inu x Boku SS. The Guardian Characters could be very useful IRL. I could use one that can help me do my homework. It also helps that the original creators of Shugo Chara also made Rozen Maiden.",1
No real tsundere would admit it ... not that I would know ... b-baka.,1
"I don't know, how about you go read some of your writing and reflect in the corner over there?",1
"Break Blade become to ""Sasuke Genius"" Boy, the Mechas there become to much Human ""ninjas"".. How they move in close melee combat, i do not saw these Mechas as real ones, just an other form of Humans.. Seems like they forgotten the weight of these things... 

",1
"I'm going to provide a dissenting opinion and say that *Code Geass* is kind of a train wreck. It's loaded with tropes and cliches, the plot is full of contrivances, and characters change allegiances seemingly at the drop of a hat. A lot of people like the show in spite of all that (or maybe because of it), but I personally think it lacks focus and is pretty bad. As usual, your mileage may vary.",1
"Mugens sisters style is mildly [Native American](http://imgur.com/060RYWB)

IÂ´m not exactly surprised that Mugen killed in the past, he kinda [seems like the type](http://imgur.com/J5gB1er) :-)

Why canÂ´t his sister survive on her own if she grew up in hell I wonder - probably just a psychological thing...

I hoped that he would run his horse off the cliff and I love him for the fact that he did. *(sad about the horse though)*

Mugen is kinda cold towards his sister, she is a bit weird too, though. I canÂ´t even imagine to grow up with nothing but criminals around me.

&amp;nbsp;

I love that we finally learned more about Mugen's past, I hoped that it would come sooner *(and not when we already watched half the anime),* but better late than never. Now we just need to learn much more about Fuu :-)
",1
"I've been saying it for a while to defend the show, but one of the main themes/plots of the manga is Junichi learning to grow up and be an adult man who understands love and boundaries with women.",1
"[Full OP of Spice and Wolf](https://www.youtube.com/watch?v=W6q1AWnjNiU)

[Nisekoi-meirou](https://www.youtube.com/watch?v=T1DUoqjMEI8)

[k-on! Pinch Daisuki](https://www.youtube.com/watch?v=tybHA2x-TFM)

[Attack on Titan-Barricades](https://www.youtube.com/watch?v=qAgPH1CWiAw)

[girls und panzer katyusha](https://www.youtube.com/watch?v=mtAqmVBbDX0)

oh jeez, there's so many.  This is just what I grabbed quickly.",1
Nothing since i want to have my own opinion and not rely on someone elses opinion when i choose what to watch,1
"While the NicoNico shows may not have as high quality models or animation when compared to the Magical Mirai shows, this show is my favourite too because of the sheer creativity they put into it. This is a spectacle and a show, almost like a musical, while Magical Mirai is just some dancing.

[the ending performance of Sayonara Memories](https://youtu.be/u_QS0sjg6YU?t=31m5s) is one of my favourite Vocaloid performance of all time 


[link to the whole concert for anyone that's interested](https://youtu.be/u_QS0sjg6YU)",1
"Canon alternate timelines. ""Continuum Shift"" ""The Wheel of Fate is Turning"" ""The gorilla fate is yearning"" ""My banana cake is burning""",1
"Ooh yea I know that one, I watched one episode and then stopped because of the fan service haha I might someday go back to it since you're giving me a positive perspective on it",1
I heard it's much better but I'm not taking the chances since most people seem to love the first part. I still regret coming back to it after I dropped it near the end of episode 1.,1
"Au contraire, I love it, and I just can't imagine a Japanese hack 'n slash game doing it anything but injustice",1
"I'm not trying to assign all the fault at Digi. He's not to blame for this. Because I agree, it happens with Gigguk, it happens with other popular youtubers, and it happens with the general consensus.

I too have seen the ""I didn't like this but it's great because everyone said so"" and it's equally as baffling. People need to think for themselves more in general as well as trust their own feelings. I mean it's even ok to not like things even if they are good. Even if the person in question thinks they're good. Just got to be true to onesself. 

Edit: In the case of Eromanga-sensei I do think it's unfair to blame it on Digi when do many different popular youtubers and other influencial people keep on posting about how it's trash. I'm not as concerned about who is doing it and where they got it from, but that it's happening.",1
"Why do you think that? As military reliance on drone warfare really ramps up, the allegory and perils of mobile dolls are imminently poignant as a cautionary tale.",1
Because OP is 11 and doesn't want his relatives to know he watches hentai,1
I just made a account maybe 2-3 month ago once I started to take interest into watching anime instead of just reading.,1
"The sex scenes *don't* detract from the story, we can debate about the quality of the writing all day, but 5-6 h-scenes that take up 30 minutes of a 100 hour long Visual Novel would go by anyone's head. Heck, there's a **completely** revamped version that doesn't even have sex scenes, so at the end of the day, the h-scenes are nothing but the past, *they* *don't* *matter* *anymore*.",1
"[F/Z](/s ""It was when Kiritsugu was in the grail and the grail spoke to him through Irisviel. Told him it was going to kill everyone, etc. Then it confronts him with her and Ilya, saying they'll be the last two other people left, and he rejects the grail by killing them both; he shoots or stabs Ilya, don't remember which, and strangles Irisviel pretty much the same way Kirei strangled her (her kneeling, him over her, crushes her throat/breaks her neck at the end). At least that's what I think happened? :P"")",1
"finished KonoSuba, loved the entire cast, hilarious show, good s1 OVA, **8/10**

finished Monogatari Series Second Season which had some of the best arcs in the show thus far. masterful storytelling and character development that made me give this show a **10/10**

starting shokugeki no souma s1, because a friend recommended it to me and i want to join in on the s3 hype next season, pretty funny and i love over the top stuff and i don't mind the ecchi. i'm only 2 eps in so far but it looks like i'm going to enjoy this one quite a bit

i watched redline. i had seen this movie before like 6 years ago, but i didn't remember much of it. i see people saying that you shouldn't take redline too serious and that the characters are supposed to be silly stereotypes and stuff but i just couldn't get into the characters honestly. the animation was super fluid and extremely nice (shoutouts madhouse) but during the 40 minute or so race part most of the time i was just asking myself ""what the fuck is happening i can't see anything"". the voice acting was really well done though and it didn't feel like a waste of time, so i'm feeling a **6/10**",1
"Tada Hitori, Duvet, Kogarashi Sentiment, Venus to Jesus? Excellent list.",1
"[**hai domo**](#peacepeace)

How is it going ? I'm finally done with uni related stuff, all that's left is some papers regarding my flat, but I just gotta hand them out on September 1st, so I'm relatively free starting now. 

I should receive Persona 5 in a matter of days and I'm **very** excited to play it, it's also the first time I play a game from the franchise (P3 FES PAL cost like a hundo at least, which is fucked up). Only thing is that I don't know which language I'll be playing. I hate french localisation with passion, so I'd be happy with an english copy, but the site I bought it on was a mess so I don't have any info on that. I miss the times when PAL versions had several dubs and you could just pick the one you want.

Now I'm gonna finish Shokugeki no Souma, probably start S2, and hang around a bunch

[](#mmmmyrgh)",1
It is more incestual than step-siblings. Looking at you anime that don't go all the way.,1
I'm pretty sure this is one of the marquee events on this sub. It'd be safe to say people look forward to it every summer. It's essentially become synonymous with summer for me.,1
Who are these people and why are they all dressed like GRArkada?,1
"So her looking EXACTLY like it is just a coincidence, sure :P",1
[Here's](https://m.imgur.com/a/o8HPg) an Imgur album of the real life locations in Steins;Gate.,1
"Oh I don't even consider movies.

I don't think you can compare TV shows to movies.",1
"Oh my I'm so sorry, I saw a censored pic. How can they have the indecency to not censor that?! ",1
"I know a lot of people hate love triangles but I never knew why. I myself don't mind them. Care to explain why? I've always assumed it's because they're used often and now feel ""generic"".",1
Please don't make me go ballistic on you it is NOWHERE CLOSE TO RE:ZERO it is in fact extremely different in the since that he never really has problems with any thing from stoping a revolt in 5mins to beating a guy who would be like some awesome boss fight that goes on for 30 episodes to the equivalent of cannon fodder but fights and overcoming stuff is not the point of this WN/LN it's more just watching him do things like SPOILER found his own kingdom and stuff,1
