comments,subreddits
Akagi is still Alpha as fuck and Sugawara is suffering. Definitely my two favorite couples so far. ,1
"""Oh man I can't wait to vote.""

*opens link*

*starts sweating*",1
omg i was thinking the same.... azumi u the alpha AF BOI,1
I'm glad you're considering a rewatch. This series is far from perfect but it's certainly very enjoyable. I personally did like Subaru and more interesting characters are added to the cast later on as well,1
I live with my Shanghainese girlfriend and I agree with the OP.,1
"What does speed-subbed mean?

Anyway, I have wanted to watch it for a few weeks now, but I'm currently in the middle of 5 different shows (Trigun, Lucky Star, Darker Than Black, Firefly, and The Big O)",1
I swear that guy is there to channel the author's sarcasm into oblivious quotes.,1
"Plot twist: they just loop that ending for 90 minutes, cue everyone burning the theaters down. Anno walks away so rich he couldn't have made a better end.",1
"minor spoilers to see if it gets your attention

[YGO Arc-V](/s ""The main premise involves the main character, Yuya, finding out that they live in a multiverse with 4 other dimensions-the Xyz Dimension, the Synchro Dimension and the Fusion Dimension. And each dimension is based off a different YGO series. The Synchro Dimension involves a class divided city where people play trading cards on Motorcycles. The Fusion dimension involves a Duel academy on an island."")

[YGO Arc-V](/s ""In addition, each dimension has it's own 'protagonist', a Yu- who shares the same face as Yuya and has a matching Dragon. And each dimension also has a girl who all share the same face and have a close bond with the 'protagonist' of their dimension."")

[Arc-V](/s ""the main plot deals with Yuya having to stop an potential cross-dimensional war, meeting and fighting different protagonists."")

[Arc-V](/s ""And as if that all wasn't enough, Arc-V also brings back characters from previous series. Jack Atlas, Crow, Aster Phoenix, and Alexis all make appearances to represent their dimension."")",1
"I'm not just talking about the world. The core of Fate/Stay Night is Shirou and how his character develops, ideals questioned, as he goes through three different journeys in it's three routes. Fate/Zero keeps to that core because it is a direct prequel to Fate/Stay Night. They are the main entries of the series.

Fate/Apoc does not explore that aspect of the series in any way, because it's just a bunch of action. Yes, there are people that watch Fate/Zero and Fate UBW for the fights, but those people aren't really the ones that appreciated and really liked Fate, the ones that are actually invested in the franchise.

Your point that Fate/Apoc is supposed to be appealing to non-Fate fans is the direct opposite of my point. My point is that Fate/Apoc is a terribly entry point because it has little of what most people like about the main series content. It's literally a spin-off that, like I keep repeating, is just trying to be schlock action.

Of course, the show is still shit, but there are way too many people who should have known to just stear clear unless they wanted to watch it because it was bad.",1
Hajimete no Gal and now Smartphone? YAY! The less shows I have to watch on the high seas the better!,1
"That art looks like it's from Tiv who did [Masamune kun no Revenge](https://myanimelist.net/manga/46716/Masamune-kun_no_Revenge), so I'm sold on art alone.",1
"Vacation commenceth!

[](#modabuse ""Wait, that doesn't seem like the correct comment face..."")

[](#cantbehelped ""Eh, whatever."")

[](#excitedyui ""VACATION!"")",1
There's a hell of a lot more where this came from.  Watch it.  ,1
"Hyouka. There's tons of reasons I love it. I love the visual storytelling, its use of value, colour, cinematography and over the top metaphors. I love the music and how it integrates classical music. I love the meta elements. I kind of relate to Oreki (despite finding it annoying whenever he brings up his energy conservation/grey life). I really like his arc throughout the show. I also love at how the show builds its setting and hints at minor characters having lives and personalities that we don't actually see. It does this with its supporting cast as well, Mayaka and Satoshi's lives are hinted at before they become plot points. It's also just really comfy and easy to watch. I put on a random episode whenever I'm feeling bored and have nothing to do.",1
"No idea, I own the stream version, so i have no need for another implementation.

On Android you can download the introductory bit for free. From what I can tell it works fine, though it looks like the full VN engine, so, I would wager it will just eat battery life.",1
"I watched that a few times but always stop before the ending spoilers (well, I always hear the first line, but I watched the video on Car Boys and meta-narrative before watching Car Boys, so I'm kind of spoiled a little anyway.) That Shelter edit is a fucking masterpiece though. That tells a story so much more compelling than the original Shelter. Like, a legitimately really damn good story, not ""for a youtube edit"" or anything like that. I keep being super damn impressed by it and watched it so many times already. Car Boys fucked me up.",1
Up vote for power level... If you hadn't posted it I would have.,1
"Hi FTF. I've got a question that I don't really know where else to ask since this is the only place I come to on reddit anymore, though I'm not quite as active as some of the regulars here. Anyways what I wanted to ask is how do you get motivated to change your life? I hate myself and my life and it's all 100% my fault, but the worst part is that I have literally no desire to change. I've had chances to change but never took any of them. I know this is bad but even though I hate how I'm going I can't bring myself to do anything about it. Maybe I just need to get lucky and find something that inspires me idk.

Anyways I'm probably going to be going to bed now so sorry if I don't respond. Also sorry for the heavy stuff.

[](#katoupls)",1
"That's not weird at all, that's just how our mind works. It's much easier to remember stuff when it's associated and connected with other stuff that's easier to imagine or which you already know. That's why mnemonics work so well.",1
"I didn't understand much of the lyrics, but it certainly captured your country's spirit of nationalism.",1
"Flip Flapping! What a pleasant surprise, I loved this show but heard it bombed and assumed it would never be heard from again. I'll definitely pickup blurays whenever they get released.",1
"[I see you hiding back there, ](http://i.imgur.com/VUroVe5.png)

[You son of a bitch](#moeshitarcher)",1
"I'm a grown man and I admit it, it made me tear up. The worst part is that you kept hoping things would get better, and they just got worse. 

The line that finally got me was [when he said simply and plainly ""She never woke up.""](/spoiler)",1
"Bro, you say that was OOC and yet there's Jeanne in the preview declaring how bright heaven was.",1
"Obligatory first time watcher, first rewatch thread, posted in most of the threads so far.

Crunchyroll's subtitles kept screwing up so I missed some of the dialogue, and watching the episode was a bit more frustrating than usual. I still enjoyed it, mostly.

At the beginning of the episode, we see that the girls' hard work has already started to pay off - actual recognition, a delay in shutting down the school, and a bump in their space. I imagine that Eli had something to do with this - in an earlier episode it seemed that the student council had considerable control over clubs. Even if they don't have explicit control, she's obviously got it good with the Director. From what I've gathered from other anime and from what the internet says, clubs are accountable to faculty advisers, but the student council seems to have a lot to do with organization.

Honoka genuinely is a force of nature. They see her coming and just know that there's nothing they can do but accept the glomp.

Umi makes it sound like Maki doesn't have a good head on her shoulders. Don't you do that to best girl. Like, pretty much every episode she's pointing out all the hurdles they still have to cross and shutting down people who are going to far. And Maki, what are you doing with Nico? No, girl, you've got so many better options.

I love how they just straight-up call out how yuri-baity Eli is, with Honoka's long, lingering evaluation. And I can't imagine that it's a coincidence that they flash the episode title - ""Wonder Zone"" - while the camera lingers on her legs and thighs (I know that it's actually the song about Akiba, but I can't imagine that the juxtaposition wasn't intentional. Nico getting mad that she's obviously not on Eli's level (in casual clothes *and* in the maid outfits), and then Nozomi making sure her waifu doesn't get to uppity, just adds to the comedy. It was just a really well-directed scene.

The trip to the school idol score just sounded straight-out pornographic. Hanayo and Rin need to keep it in their pants a little. And Nico is yet again causing trouble for people because she's putting the cart before the horse. Lady, you'll be hot shit at some point, and you're on your way there if you work really hard, but you don't need to be making everyone dress like a chilly asthmatic.

When I saw that Rin was legitimately fooled by Kotori's foreigner ""ruse,"" I immediately understood how she was failing in school. Everything immediately made sense. Also, Eli's face at that was absolutely priceless. Like, yeah, yeah, her heart is all melted and stuff, but she's constantly reminded that she's surrounded by idiots.

GODDAMN IT NOZOMI STOP GRABBING OR THREATENING TO GRAB PEOPLE'S TITS WTF IS WRONG WITH YOU? I thought Nico was the pro stalker, but Nozomi taking it to a new, rapey level is just... Jesus, somebody call the cops. Please. She's got some redeeming qualities but I'm 90% sure that the signs on subways about reporting improper sexual contact are because she's going around going washi-washi on all the women. Gross.

Kotori's attempts at writing lyrics remind me of Mio's lyrics from K-On, except that Kotori's both worse at it and knows that she's not very good. I mean, both are good and wholesome girls but there's only so much you can write about things being cute and fluffy.

Also, Kotori is legitimately adorable in her maid outfit - she's pretty cool otherwise, too, and very athletic, but working in a maid cafe suits her well. I almost understand why maid cafes are popular in Japan now. But I will never understand why Japanese people are comfortable with ruining a perfectly lovely omurice with... blech... *ketchup*. Related to that is Kotori's admonishment that Umi needs to keep her smile on even when she's backstage - retail and customer-service employees have to do a lot of ""emotional labor"" to pretend to be happy in order to make other people feel good. I'll tell you, it's exhausting.

Honoka-Umi-Kotori lesbian poly triad is now canon.

On a fashion note, in addition to Nico having a casual outfit that looks a lot like a more straightened-out version of Honoka's top, Rin seems to have the same thing going on. I bet that's been the case this whole time and I just haven't paid attention. I thought I saw the same thing going on with Nozomi, but closer inspection makes me think that she's got a halter top or something like that underneath instead of a tank.

Cultural notes: While watching, as soon as I saw that picture of Kotori, I thought she must have had something to do with selling all of that unlicensed merchandise, so her being a maid cafe performer came out of left field. But maybe Japan has a less stringent legal perspective on copyright and image rights. I can't imagine being able to have a massive doujinshi market in the United States or most Western markets, but obviously that scene flourishes in Japan.

On a detail note, when Eli said goodbye to Umi and Honoka, she was turning into a street with a sign saying ""Matryoshka."" I went down the rabbit hole for a bit on researching Russians in Japan and the influence of the Russian Orthodox Church, but Eli's family isn't particularly special. Her grandmother *might* have been the child of refugees from the Russian Civil War, apparently called in Japan the ""White Russians."" That would also explain, timeline-wise, why Eli's family went back to Russia during her childhood and the post-Soviet reforms, and then why they'd head back in time for school with the increasingly unstable political situation and economy.",1
"Yeah. And on that note, Holo has an even harder battle next (battling through all the Megumin spite votes).",1
"Homura from madoka magica. seriously the end of rebellion made me hate her for what she did to madoka. Yet all the time i see people saying ""homura did nothing wrong"" when what she did was so obviously wrong!!! ",1
its and anime about ice figureskating in what world would that ever be exciting? ,1
"Once again another great episode,all this lies are making my head spin with speculation tbh.I just wanna know what is gonna happen in  the end dammit

Cant wait for the ponytail and swimsuit episode next week HAHAHA and its funny how the first four episodes of this series have more kisses than one whole season of any romantic anime series ive seen ",1
"Certainly should finish whole FSN and Zero before watching FKLP. 

Its not just spoilers overall. Knowing context of all three FSN routes and what happened in Zero helps understand a lot of things in FKLP. ",1
"[](#k-on-hug)

Hey Lily, hope you're having a swell birthday!

Back to sticky, where the cycle begins anew!

I'm okay, I just got home. Family's out somewhere, so that's all right.",1
Nah. The first arc it seemed like it had so much promise and then it shit the fan royally. I know nothing about anime reviewers and I have an absolute hate for the show now. The weird rape-y like scene and his sister basically having the hots for her brother were way too much for me. One of my friends still likes it (don't have many anime friends irl) and I have to admit ranting off all the reasons why I hated the show when he asked was weirdly cathartic.,1
"I tend to have this with a lot of loli characters, theyre cute in ways that make you want to protect them, like a little sister, fanservice shots of these characters are awkward as fuck (which is a reason I'll never watch Prisma Ilya for example)  

One of my favorite lolis is Tsumugi from Sweetness &amp; Lightning because shes just a ball of adorableness and completely free of awkward fanservice",1
"She is not liking it. She ask her to stop several times. That's something that infuriates me in anime, it's not rape if she somehow enjoys it.",1
"I know it's necessary, but I still prefer how they look with their normal hair.",1
I spelt manga wrong fixing it nie watashi wa baka ,1
"Oh god, just read the only 3 per franchise...

RIP omnibus anime and my four Clannad nominations, either TomoyaxKyou or TomoyaxTomoyo is going out and i don't like it!
",1
"&gt; Also, who is that green/short haired girl in the kitchen? I'm so sure I heard that VA somewhere before, but I can't remember where. She's also not listed anywhere, maybe that changes after the next ep.

Isn't that just [Subaru](https://myanimelist.net/character/148711/Subaru_Wakaba)?",1
"Fireworks, Should We See it from the Side or the Bottom?Â 

New anime movie by shaft based on a live action drama of the same name releasing in August. ",1
I read the manga and don't regret it cause I'm hyped to see certain scenes.,1
Thank God for the censors. I wouldn't want nudity in my good Christian anime. ,1
"I don't think it hits any spoilery notes but...

[I guess these are Symphogear G spoilers](/s ""Tsubasa and Maria both use a lot of vibrato. This makes sense. Theyre professional singers. They should be able to. Chris, Shirabe, and Kirika use a pretty natural vibrato...and are about in that order of how often they use it. Chris was raised in a family with a lot of music, so it makes sense thst she had a little natural spin to her voice. Shirabe has a very level and pure sounding tone, sort of matching her idealism with these very beautiful vocal vibratos occasionally..while Kirika, the hot topic Edgelord that she is, sacrifices it for some other vocal tricks. The kicker is...Hibiki. Uses almost none. In the first season, I don't think she has any vibrato at all. But she's the only one that literally has a relic buried inside her body. She's also played out as a slacker when it comes to learning. She might just not know how to vibrato."")",1
"I haven't watched much anime in quite a while, and most of it didn't have a great story.",1
"Listen to silverhydra, r/fitness is pretty well-run in my opinion.

Also: I lol'd on the ""loose weight"" part.  What is it about *that* word specifically that people have trouble with so consistently?",1
Definitely. The characters are really well written but it does have some echhi if that's not your thing,1
Hunter x hunter has a slow start in favor of characterization for 26 episodes. Fullmetal Alchemist is some considered the perfect adaptation.,1
"Yeah i think it was intentional, but there's stuff that just doesn't translate well from manga to anime and this is just one of those cases, but also when they do cut there are people not satisfied like the guy posting a thread about the manga differences each and every thread (which I'm not really a fan of since i think they should be free to work however they want with the source material and not be slaves to it)


*oh wow guess i went off train there lol*",1
"Kuroneko's the worst of the chicks in OreImo.

Just think about it for a second, guys. What if she existed in real life? She's a goth Twilight fan with delusions about the occult. These people are repulsive in real life, and I'm not even talking about looks. 

Manami's loyal and adorable with an awesome family. Saori's rich, hot, and a total bro. Kirino's a bitch, but at least she's hot. Kuroneko just loses on every front.",1
"&gt; Unfortunately, it seems like those kinds of cookie-cutter shows take over the selection of new anime more and more every season.

$, $, $, and more $. That sells like hotcakes, and it's pretty dumb.",1
I don't see why that would be a problem. A simple look to the size of laptop batteries will show you that the size of energy storage is a difficult design problem.,1
"Given that the ending isn't conclusive, it is as true as you want it to be. 

If that's not at all, then it is not true at all. The miracles afforded by Death of the Author are great indeed.",1
"I just started it personally, I hope it lives up for me too. Little put off by how many seasons and movies there are though, I usually try to avoid that.",1
"&gt; I'm sure they'll understand

Ehhh. One of them was kinda hoping to use my house to generate income, so I expect cries of ""Uragirimono!"" soon enough.",1
"I wont allow Koyomi x Senjougahara losing. If they do, ill take this sub down.",1
YES! My friend and I were just at the expo today! First ever convention for the both of us. Amazing. We actually forgot to take photos of ourselves. So here's one of the [Gundam](http://imgur.com/1bcCS) and the only one of my [friend Chris](http://imgur.com/Xgng3).,1
"&gt; Also am I just dumb or is the way Yun's speech subtitled different from last season? Like I might just be an idiot here but I don't remember her dialogue reading like it does this episode.

Definitely different, it makes sense since she uses some accent but no idea why they didn't subbed it in the first season.",1
"thank you bro but i needed them in original chronological order, shot by shot.",1
"Its been a while since I dropped something. I think it was [Basilisk](https://myanimelist.net/anime/67/Basilisk__Kouga_Ninpou_Chou).

It was just really boring. Bunch of disposable characters I didn't care about being dicks and killing each other for reasons that I also didn't care about, and the action wasn't entertaining enough to carry it.",1
"Oh yeah, I absolutely loved it at first. Especially since some good guys were actually dying. Finally felt like there was some real weight to things, and then.. nope. 

I really wish I could be hyped for Boruto, and get back into it, but it's just not the same anymore.",1
Maybe? I remember the girl falls on the boy on top of the stairs,1
I thought you said you played eroge when you were 7 years old lol,1
"Layer 04 was ""religion"", yes?

A Certain Magical Index

Blue Exorcist

Fullmetal Alchemist

Neon Genesis Evangelion",1
"I mean, who needs cooking anime when you can just have eating anime?!?!",1
"True, but again I was just trying to make an example and okay its maybe not the best one I could have made. ",1
"It's one of the reasons I was so excited when I heard Kyoani got Koe no Katachi. That manga is so reliant on smooth and subtle body language, as well as the explicit ""body language"", and it was the one thing that I knew would make or break it going in. But when I saw Kyoani got it I knew it was in good hands. ",1
"One of the reasons they're my favorite couple has a lot to do with the fact that they actually talk about their relationship with each other. It happens pretty regularly, and one time it gets them past something that might break up another couple for good.",1
"It's a show with layers. The more you think about it, the better it becomes.",1
"Fair enough, if i want you to take one thing from this conversation, just one thing, think back to how you or someone you know viewed anime before watching.

""It's cartoons how do i care about that"" or ""It's all hentai stuff"", and just remember how many animes brought you joy over the years.

I just really think it's unfair to yourself to deny yourself the pleasures of this world because of a change of mediums, there are fantastic works in every single medium (TV/video games/books/light novels/visual novels/anime/manga), and just think of a friend who doesn't watch anime and how he/she might be missing out.

I'm not telling you to read it, i'm telling you to change your paradigm when it comes to visual novels and understand my argument, that's all.",1
"The show was decent, but buddy you're in the wrong section, not anime.",1
Chivalry of a failed knight is one of my favorite shows. For fun maybe check out Overlord. For just an all around amazing show watch The Kings Avatar. Can't say enough amazing things about this show. As for old school check out Outlaw Star.,1
"&gt;I do hope that we'll get to see El save Azazel or at least have them find each other when more fighting goes on later, and also the hilarity that'll ensue when he finds out that he was taking care of Jeanne's child the entire time.

He already knows, Charioce told him after he got captured.


&gt;Really, really fucking happy to see Lucifer again, my favorite shinbaha character

I'm happy for you. Mine probably won't get animated, like ever. Probably because she's a referal card.",1
"These girls keep talking like there's a whole story we're missing. Kanon talks about having gotten Shiho back, and Shiho talks about not having lost Kanon... It feels like this anime is going a bit overboard in telling us ""HEY, GO PLAY THE GAME IF YOU WANT TO HAVE A CLUE WHAT THESE GIRLS ARE TALKING ABOUT!""",1
"No Game, No Life (Super OP), and Problem Children are coming from another world, aren't they? (The main character is in a class higher than gods)",1
"Lol, as if that 4th one on the bottom ever be filled",1
"I still can never understand how people like KLK more with ots completely nonsensical brainless plot that broke tension every two minutes because mako needs to act funny.

Ttgl is silly at times but i actually gave a fuck about the plot, the writing and worldbuilding were also good",1
"Shinobu.

Though [here's the 3x3 best girls I made a while back.](http://i.imgur.com/3QDq6OQ.jpg)

As you can see; a third of the list is Monogatari...",1
Could be worse. They could be set to the percussion section of The 1812 Overture.,1
"Gamers is a rom com about people who are gamers, so there actually is not that much similarity. But that is definitely the one where there could be. ",1
Tatsuya was enjoyable simply because of how stupidly OP he was and because women didn't scare him. I just found it hilarious at times. It felt almost like a parody.,1
"Lmao you think trudging through 3-4 episodes is enough? Try watching an entire series hoping it gets better! ðŸ˜‚ðŸ˜« #nodropsquad
But seriously this show is awesome regardless.",1
"It's a comfy and warm show to watch and I'm actually fine with it despite not liking shows like Flying Witch.

Although to be fair I watch it at 2x speed :P 

It's kind of like Bartender in the same way except that it's more about the people that walk into the restaurant than the restaurant itself. 

I think you should try one episode and that should be enough to tell you if you will like the show or not. ",1
"Just finished it! Definitely going to continue reading it. Really interested in seeing how things develop. Feel like this could be either really good or really bad, but seeing how popular it is I don't have much to worry about",1
