comments,subreddits
Where is the middle right picture from? I recognize the artstyle but I can't put my finger on where I've seen it before.,1
"Soul Society Arc from Bleach
Pain Arc from Naruto Shippuden
Sister's Arc from Index ( hate the rest tho couldn't bear finishing it ) and the one in Railgun which is slightly preferred
Android Saga DBZ
Jojo's Part 2 (does this count as an arc?)",1
Pretty sure that's just a western slasher movie trope. The typical 'young ones getting it on while a serial killer lurks in his wait'. Don't think it exists in anime.,1
"For the first season, you can just watch the movie instead. The pacing and animation are both a lot better and nothing of importance was lost or cut out. For A's, both are great. A's had a lot less fat to trim, so the movie did skip over a few things, including a certain spoilery plot point. It's not a major blow to the story, but still. I'd say watch the TV series first, then the movie. ",1
"6.62, although I've only seen a little over 100 shows.",1
Considering that two of the smart students were suspicious of the whole thing from the start and somehow never checked the rulebook is more than hard to shallow. I was under the impression that the rules were purposefully omitted from the book and the narrative seems to support that idea. The fact that the teacher never once mentioned that incredibly important detail when she was explaining the points system was definitely on purpose.,1
"Just going off the vibes i remember from the series: Kiznaiver, Rokka no Yuusha, and a maybe Kekkai Sensen. I suppose SAO has some common stuff as well if you can ignore the reputation and haven't already seen it.",1
"According to you, at what age are you not considered young anymore ?",1
"An exception. 

That should be sports anime, not manga. My bad.",1
"Yeah, but then you'd have a raging boner in public ",1
"&gt; Anything interesting happening?

Not really but there was an 'AYA' trend earlier.",1
"The default for the SAO movie is set to dubbed, take a look at subbed too. 

The Mahouka theater listing has actually decreased since it was posted roughly 3 weeks ago. (Which is why I'm sad since my local theater won't be showing it.)",1
Non-linear storytelling is cool and all but it also has to be cohesive and I'd prefer watching a series if the events made sense. Also it being the airing order is not a strong justification for it. Newcomers I'd imagine would prefer things flow like a regular story. The only positive I see for the broadcast order is that the series doesn't end on The Rainy Day ep which is one of the most awful anime episodes I've watched.,1
"Like I said, waifu is the absolute. The concept of 'better waifu' is logically impossible, as 'waifu' contains the inseparable meaning of 'the best'.

If you find that someone better than your ""waifu"" comes along, then it simply means that you were too hasty in deciding on your waifu. You were too lighthearted, too flippant, when making your decision. This is not only disrespectful towards your old ""waifu"", but towards your new ""waifu"" as well. Nay, it is not simply disrespectful, but an outright insult.

She was never your waifu. She was simply someone you were deluding yourself into *thinking* was your waifu. You were mistaken, ignorant, and lacking in reverence towards the sacred position of waifu, when you decided on her.

Though speaking of 'deciding' on waifus is nonsensical itself. One does not pick a waifu. A waifu simply *is*. Your waifu has been your waifu since the very beginning of time, and will continue to be so until the end of eternity, even if you have not always been aware of her.

There is no ""evolution"" when it comes to waifu. There is no stepping from one waifu to a ""better waifu"". Waifu is what awaits at the *end* of that ""evolution"". Waifu is the pinnacle, the perfect being. Once you reach perfection, there is nowhere to go. No *need* to go anywhere, as any change would be a change for the worse.

No, the inferior girls were simply objects of affection. Some of them may have been special, and may still be, but they were not your waifu.",1
"While I've only seen half of the Monogatari series so far, I could see someone suggesting another person to watch it in a different order. I find the broadcast order makes more sense emotionally for first-time watchers. I'll have to rewatch it in chronological order when I finish everything.",1
This is just utterly terrifying and interesting at the same time. Reminds me of the Abyss in Dark Souls.,1
What's not to love about an econ professor that's also a dog,1
"Monster, Psycho Pass, Death Note before it began to suck, everything that came out of Satoshi Kon's beautifully unhinged mind. These are the anime that I live for. I love slice of life, CGDCT, and mindless action as much as the next person, but it's anime like these where I feel like the medium really gets to flex its muscle.",1
That's fine! Just talk to more people and you'll start getting more senpais!,1
"YLiA would've been better if literally all the sideplots hadn't been in some way or another about Kousei. It just got dull and repetitive during the the third quarter, and stretched my suspension of disbelief to the breaking point. I still really like the series, but it's a really annoying fault that holds it back a ton.",1
"&gt; And the girls singing in the ED looked absolutely adorable!

Hifumi is singing. *Hifumi* is ***singing!*** In season one she panicked when it was her turn, and resorted to IMs, but now she's able to sing along and smile. She truly has grown. :)",1
"Best part is she pushes Shuuichi out of the way while she carefully navigates around the girl. Shows how familiar she is with Shuuichi to be able to do that to him (or, you know, fuck Shuuichi and all that). ",1
Maybe they don't make it as good down in Pune.,1
"I actually just got done watching Dance in the Vampire Bund.  I knew nothing about it, so I gave it a try.  It has vampires, werewolves, nudity, and romantic promises.  12 episodes long.",1
"In the normal universe Trunks (a boy) is called Princess Trunks and promised to wed a male Broly.

In the other universe  Trunks (a girl) is called Prince Trunks and is promised to wed a female Broly.

Both genders are swapped and the Vegeta is still a jerk to his kid.  :) ",1
I hate him. He's an egomaniac. He's a prick. He's a dick. He's smug. I hate him.,1
"I'd like to offer [Master Keaton](https://myanimelist.net/anime/1483/Master_Keaton) (**24 episodes**) or [Master Keaton](https://myanimelist.net/anime/1483/Master_Keaton) + [OVA](https://myanimelist.net/anime/1910/Master_Keaton_OVA) (**24 episodes** + **15 episodes**) in exchange for a show with similar lenght from my [PWT list](https://myanimelist.net/animelist/Addi?status=6)

Note: Master Keaton is **completely episodic**.

**OR**

a double blind for all of the [**high priority**](https://myanimelist.net/animelist/Addi?status=6&amp;order=11&amp;order2=0) shows (not the movies) on my PTW list.

Edit: Im gonna limit myself to one contract this week. See you guys next week!",1
"Considering that Bebop is the main example I use in the video, I'd hardly call it click bait. I also have ""The Importance of the Macro"" in the title to express that the video isn't just about Bebop.",1
"NGE anime (have read the manga and movies) 

Cowboy Bebop*

Revolutionary Girl Utena

Berserk 1997 anime, read the manga instead. 

Legend of the Galactic Heroes* 

Any music/ anime, such as K-On* or Love Live!

Most Ghibli movies*

Trigger's previous works and Gurren Lagann*

Hunter x Hunter*

The * means I intend to watch them in the future. 
",1
"Cutest show this season. I love how it leaves me with a big smile after each episode.

Also Karen is weak to tickling. Cute",1
/u/holo_of_yoitsu hasn't really been posting official releases for this season yet. It's usually slow at the start of the season because of some manual tweaks that need to be made by the owner.,1
The LWA OVAs used to be my gateway drug for my non weeb friends,1
"Holy shit I'm not going crazy when I saw the ""ain't"" I was like....did I miss that first season?",1
"At least with Amazon, someone can screen cap it and upload it to miau anyways...",1
"Yes, but here's one person who says [that was based on bad translation.](http://wildgrounds.com/2010/06/16/create-your-own-spirited-away-thesis/)

Not that we have any experience with that, right?",1
"Hello, your friend has a weird taste of anime only choosing 1 specific categorie (romantic) i'm assuming your friend is female. that would explain alot. i'm recomending ReLife. its a really fun anime! I hope it will help for curing her depression!",1
"If you think my list is big you should see some of my friends lol. For Neon Genesis I've looked into it but I never knew where to start with the series, it all looked really complicated, maybe that's just me though. Thanks for the comment bud.",1
"How early is the spot because I was told than it happens about halfway through (which seems like a lot to me) 

",1
Lucky Star made a new song when parodying [Initial D](https://www.youtube.com/watch?v=PYPZum8Pxvc). The group they were parodying liked it so much they made an official [cover](https://www.youtube.com/watch?v=_HXVwNnhz04) themselves.,1
"High school of the dead, the scene with the bullet going in between boobs, the only slow mo scene I can remember, I know I've seen others, but that one is most memorable to me.",1
"It's no Momento or Pulp Fiction in that regard, but it is interesting.",1
"The show needs to stand out. That doesn""t mean the show has to be completely different from any other anime, but it needs to have something that makes the show special. At the very least, the shoe shouldn't use tropes and cliches. At least not to a large extent. A good example would be Hyouka. The show also needs to have well written, fleshed out characters (that's a no brainer) and have have the characters have interesting interactions with one another. Something along the lines of Monogatari or Tatami Galaxy.",1
"I don't think there is a problem if some authority sees you with it, just awkward.
But you made me wonder, what about hentai of really young protagonists? ",1
Oh I get it the light novel started in 04 recently episodes were released. i was confused thinking episodes came out in 04 and the creators were lazy/,1
"I do wish people in other English-speaking countries could join the fun... I just get ""Content not available"".",1
"Alright, just a little bit more, TeamShinobu.  
Vampire lolis are 100% legal!",1
Oh god the hate will flow again for the Tokyo Ghoul Ship.   ,1
That's a nice mug.  I don't tend to go for stuff like that.  But those headphones look kind of nice.,1
What's the point of reporting it if they don't even provide a list?,1
Ashita no Joe and Space Battleship Yamato. I'd also recommend Gunbuster though it's from the 80s.,1
"I don't think it's necessary as long as the character is well written, you can have well written character and static character, also the opposite, developing / changing character but bad written.",1
"[](#glasses-push)

Alternatively, you can look scary!

[](#spookyglasses)

SO VERSATILE!

Glasses are a tool of:

* Being smug
* Being moe
* Being smart
* Being sexy
* Being scary
* Being visually impaired
* Being Â£70 short because holy shit, getting all these extra features in your glasses is expensive.",1
"And here I'll be watching everything. 

It's a good thing I love critiquing so much.",1
"I will. So long as its not more than 24+ eps and i haven't watched it already, which would of course defeat the purpose, i will watch it.

edit: just looked up Pupa... for the love of god, dont do it",1
"Good:  Interesting take on the idea of an RL-MMORPG, and an amazingly catchy OP song.  


Bad: The story was too slow for me, and it ended up being one of the few shows I couldn't finish. ",1
"perhaps I should've been more clear. I hate when people assume the character to be lewd based on popularity. Like Kazhima from Kancolle, people think shes lewd character while within her in-game voices she has barely much evidence to be considered lewd.",1
"4chan will call you a fucking autist if you say something dumb but at least they won't bury any dissenting opinions from the hive mind 

Which is exactly what reddit does ",1
"The misaka one was the ultimate shit fest though, both Holo and Senj fans votes against each other in the semis and both went out.

Biri-biri was also the meme queen that competition.",1
That's specific. Is there many anime that fit that description?,1
"Wonder if the opening ceremony will be similar to that of London that had Voldermort and others scaring children. I expect a Dragon Ball reference, at the very least.",1
"They showed one briefly in the first episode so I don't think it counts as spoilers but they have special balloons that they float up with relics or info. It's how Auntie got that letter from Habbo before he came back up.

Also, keep in mind that white whistles are the only ones without a depth limit, and therefore are the only ones that can go beneath the ""death"" layers. ",1
Depends on what anime we are talking about but some anime did indeed had a break between seasons.,1
"Ah my bland generic anime, oh how I missed them so. And it's also a very chilled anime to, I like it",1
"Fate/Stay Night UBW or Tales of Zestiria the X

Well, TV only. I must say, from what I've seen here, Garden of Words looks better.",1
"&gt; I'M TRYING
&gt; 
&gt; TO HELP
&gt; 
&gt; 

I know! Sorry, that was a bit too sassy of me, wasn't sure what else to say though.

And thank you for helping!

[](#konhug)",1
"One man's garbage is another man's treasure. I don't know about you but I enjoy all the Moe anime, the Battle Harem anime, the Isekai anime, the RomCom anime. Hell, the only reason I even watch anime is because of those genres. Most media don't really do it as well as anime.",1
"[](#kinirohug)

&gt; (oh, today I'm drinking tea, not coffee!)

[**What kind ?**](#frockychou)

[And I found something quite interesting yesterday ...](https://dishwasher1910.deviantart.com/art/Devastating-attack-691862432) (NSFW)",1
Yea at the start you think he is a dick but when you actually read his pov's you understand him a bit more and the  when it gets to reek you just feel bad for him.,1
"&gt; We can all agree that LWAs launch was terrible and if that's the way it's going to be from now on that sucks, but if Netflix improves on that I have no problem with them waiting for the entire show until they release it.

I've heard no complaints about the other anime launches they did, ajin and kuromukuro, so I suspect this was a one time fuck up and I wouldn't be suprised if netflix has fired everyone involved, they are very ruthless when it comes to staff.",1
"Fate Apocrypha offends me on a deep level.  They could have just let Fate finally die after Zero and UBW's great legacy, but they went ahead and made the movie Grand Order which sucked.  As if that wasn't enough, they made yet another installment in the series.  ""It will at least be good to atone for Grand Order and the fact they keep rehashing Fate, right?""  Well, A-1 Pictures is producing it.

I don't think I've ever rated anything from A-1 Pictres above a 7.  In fact, they've made a whopping 3 shows I actually enjoyed (Hai to Gensou no Grimgar, Shigatsu wa Kimi no Uso, and I guess Magi).  A-1 is responsible for the vast majority of shit I just don't like:  SAO, Ao no Exorcist, Fairy Tail, Shineski Yori, Aldnoah Zero (lovely soundtrack though), Asterisk War, Eromanga-sensei, Occultic 9, Qualidea Code, etc.

So all the stars lined up quite nicely.  Fate is being rehashed, r/anime is excited for it, A-1 Pictures is producing it, I wanted to not be let down since I love Fate Zero and rated it 10/10, the poster looks bad, and supreme-waifu Saber was nowhere to be seen.

Apocrypha delivered quite nicely and its very existence makes me angry.  I have plenty of anime I dislike and think are bad, but for a top 3 contender it needs to offend me and Apocrypha does that perfectly.",1
Yamada-kun to 7-nin no Majo and Nene Odagiri. Still my best girl.,1
Yeah but she also screamed at the tiny one that crawled up her arm in the prison.,1
"How can it be one of your favourites already? It's only been one episode, I know some first episodes from anime can have a huge impact but still, we still got fall to come",1
Started watching Melancholy of Haruhi Suzumiya yesterday and I just started the endless eight.,1
"I feel bad for Altair. Even if she's bad, it's not her fault. She's just a character without a story and probably she feels lost without her creator. I wish she gets a good ending.

The new guy looks like Yuuya's rival, but who's the pink haired girl? A teenage Mamika?",1
"Gotcha, I'll make sure to rewatch the series before the movie",1
Then watch the Accelerator arcs of A Certain Magical Index and A Certain Scientific Railgun.,1
"[Koi to Uso](https://myanimelist.net/anime/34934/Koi_to_Uso) (heavy bias on my part)

[Ballroom e Youkoso](https://myanimelist.net/anime/34636/Ballroom_e_Youkoso)-just go watch it

[Made in Abyss](https://myanimelist.net/anime/34599/Made_in_Abyss)-just go watch it

[Isekai Shokudou](https://myanimelist.net/anime/34012/Isekai_Shokudou) for a comfy show

[Youkoso Jitsuryoku Shijou Shugi no Kyoushitsu e ](https://myanimelist.net/anime/35507/Youkoso_Jitsuryoku_Shijou_Shugi_no_Kyoushitsu_e_TV) is Oregairu's cast meets the premise of Baka &amp; Test.

[Youkai Apartment no Yuuga na Nichijou](https://myanimelist.net/anime/35220/Youkai_Apartment_no_Yuuga_na_Nichijou) for the ""actual SoL""

[18if](https://myanimelist.net/anime/35248/18if) for some weird stuff that has potential

",1
"&gt; I'm still looking. Please point me in the direction of good modern anime on the same level as Evangelion or Cowboy Bebop.

Tengen Toppa Gurren Lagann

Space Dandy

&gt; Fanservice done in classics like Gunbuster are a masterclass of animation and art

We still have fanservice being used in interesting  ways, you yourself mention the Monogatari series, which is a pretty good example (but  not the only one mind you). And please, let's not pretend that every show back then had artistically meaningful fanservice, Gunbuster is the exception not the rule. 


&gt; Fanservice has definitely gotten more contrived and the ecchi shows don't even have good plot to make up for it.

They never did. Making it sci-fi and having the characters be of an arbitrary age you find acceptable and can relate to doesn't make fanservice any more tastefull or any less stupid and contrived.
 
&gt; I feel like it is much more fair to compare classics to classics. Yes, there are lot of genre garbage but the way those shows are garbage has changed.

 Saying something doesn't make it true, and even if it is, in what way does garbage ""changing"" make it any better or worse? It's still garbage.

Back then we had shitty, poorly written shows set on spaceship, now we have shitty, poorly written shows set in highschool, what a downgrade.


&gt;  At any rate, what do we have in modern anime that compares to classics from previous decades?

Shirobako

Kill la Kill

Psycho-Pass

Shouwa Genroku Rakugo Shinjuu

...

Do I need to keep going? Because I can. These were just a few of the shows I could remenber off the top of my head. 



",1
"\&gt;dude can't be best girl  
\&gt;posted with Kaiki comment face

does not compute",1
"You gotta be kidding me, last year you hosted a rewatch right when I left for China. This year THE SAME DAMN THING HAPPENED AGAIN. Last year's rewatch was fun as hell, and hopefully everyone enjoys it just as much this year! Just remember... ""FUN THINGS ARE FUN""",1
"As someone who's only seen UBW and literally just started the Fate route, Rin.",1
I love the visuals but the music itself... it just doesn't flow at all.,1
"I wonder if that kunai tasted like crap literally, because I seem to remember some historical archers sticking their arrows in well, crap. So that they would infect the wounds of the enemy.",1
"There are hardware limitations associated with Tegra2 for high profile .mkv's.
You will most likely never be able to play anime well on it (at least ones currently being released, older avi's and main mkv's you can).
I have a transformer and this is the only painful part of the device for me.

Edit. Oh shiet i just found a player on my tablet that will play high profile mkv with embedded subs!!!! The name is diceplayer and it has a 3 day trial. Im stunned speachless how the devs got this to work on tegra2!",1
Oh yeah I guess I worded that wrong as it was combined with my first comment,1
"[](#assman)

He is a man of refined taste and... culture.",1
Lets just call her the Allen Iverson of the anime world.,1
"Imawa no Kuni no Alice is a survival type anime with people competing against eachother, but not necessarily killing eachother themselves.",1
"&gt;3 AM

I did it again! I swear I'm slowly turning into Terran, who always stays up late, and often even later than 3 AM.

[Night!](#sleepingcutie)",1
"That's because 1.) Fate/Stay Night is a story that is told through 3 routes. You won't see or understand what truly Fate/Stay Night is unless you have gone through all of the routes. 2.) The story rely a lot on the first perspective monologue that is impossible to capture through anime. Like 90% of the story is told through first person perspective with a lot of Shirou's thought added a lot into the story.

A lot of people started going around sceaming uninformed opinions like""F/SN sucks"", ""Shirou is a retarded"" etc without knowing the real story around all the places doesn't help with how people who read the VN view anime-only watcher too and that irritates most of the VN readers to the point that some people consider animating F/Z was a mistake.",1
"Highschool Of The Dead.

This show loves it's boobies, even if it doesn't understand physics.
Its vibrant, action packed and is basically a Michael Bay movie.

With a lot of anime boobage.",1
"I'm glad that a timeless piece of art still stands above ""just a very nice movie"" in terms of monetary gains. It gives me a bit of hope",1
Was gonna watch death note but I decided to watch at least one season of Naruto and vampire knight before it,1
"Oh wow Rin absolutely dominated Saber. 

[Forget this](#donewiththisshit) [How could you...](#tearsofabestgirl) 

Dear everyone who voted against Hanekawa...

[](#nerr)  

Salt aside, there really were no bad outcomes this round. Solid characters all around, looking forward to see how Monkey does against the ZR queen. 

Yesterday there was a huge upset with the 17th seed Holo knocking off the 1st seed. I wonder if we can pull off an even bigger upset today... 

[](#curious)

**Vote Chitanda!**

&gt; What's your favorite beach episode in anime?

The one from Nagi no Asukara. ",1
"i'm glad you're doing good. drinking &amp; grilling sounds cool!

plotting out my novel, contemplating to get myself ice cream, mentally singing along to bohemian rhapsody",1
"&gt;  MiA is exclusive to Strike in the US and HIDIVE elsewhere

Not in the Netherlands, at least I cannot find the show on Hidive but I'm not subscribed. They simulcast a whole 3 shows over here and dare to charge the same as crunchyroll ($4.99 for 1080p content to crunchy's â‚¬4.99) and that's their beta price
. I honestly don't understand why they bother if they have no titles here.",1
"As a Spaniard, do you have any interest â€“ or more precisely, can you attest to any cultural interest â€“ in chupacabras? I'm trying to figure out why Spaniards might suddenly be showing up in Manoyama, and chupacabras (possibly exposed internationally by the TV show) are one possible explanation. 

Also, they've been the butt of so many jokes up to now that the writers could surprise the heck out of us by making them become the pivot point in the series.",1
There is also Livechart.me which lists every anime of a season :3,1
"Please remember what Amazon JP sells as Complete Edition, look at the last picture [CAN YOU BELIEVE IT?!](https://www.amazon.co.jp/%E6%97%A9%E6%9C%9F%E8%B3%BC%E5%85%A5%E7%89%B9%E5%85%B8%E3%81%82%E3%82%8A-%E6%9C%88%E3%81%8C%E3%81%8D%E3%82%8C%E3%81%84Blu-ray-%E5%88%9D%E5%9B%9E%E7%94%9F%E7%94%A3%E9%99%90%E5%AE%9A%E7%89%88-%E6%97%A9%E6%9C%9F%E4%BA%88%E7%B4%84%E3%82%AD%E3%83%A3%E3%83%B3%E3%83%9A%E3%83%BC%E3%83%B3-%E3%81%B9%E3%81%AB%E3%81%A3%E3%81%BD%E4%BB%98-%E4%BA%88%E7%B4%84%E7%B7%A0%E5%88%87-2017%E5%B9%B48%E6%9C%8831%E6%97%A5/dp/B071DP3Z38/ref=sr_1_10?ie=UTF8&amp;qid=1499338087&amp;sr=8-10&amp;keywords=tsuki+ga+kirei)",1
Just take solace that Holo lost to an actual developed character and not a one-note megameme.,1
"At one stage in the closed beta, someone did try to make a mod for that! I can't remember if they actually did it, but it would have worked as it was just a matter of swapping a model, but it also would have made aiming at enemy ships horrible because you couldn't reliably see their actual shape anymore, which is why I'm not sure if the guy made it or not. I tried to find the thread for it but it was so long ago (over 2 years) that I couldn't find it.

You can, however, [make kanmusu appear as your captains.](http://2.bp.blogspot.com/-QIS-Qf0bhxU/Vhp0oVGeBmI/AAAAAAAAAHQ/ORGumvv271M/s1600/Manual%2B00.jpg)",1
"&gt;I couldn't Ctrl+left/right anymore to jump 5-secs

Even by (re)setting those keys in Options -&gt; Player -&gt; Keys?",1
"Yeaah um...

Grave of the Fireflies? Forest of the Fireflies? ",1
"Good starter anime

Attack on Titan

One Punch Man

Death note 

Code Geass


",1
"How about [Midori Days](https://myanimelist.net/anime/330/Midori_no_Hibi) then? It's just as ridiculous as it looks, but the romance is really cute.",1
